[
  {
    "category" : "money",
    "condition" : "Displayed value and stored value are identical, correctly rounded (Decimal).",
    "defects" : [
      "roundingDrift"
    ],
    "difficulty" : "middle",
    "expectedBuggy" : "Stored amount drifts (Double rounding).",
    "expectedClean" : "Stored amount == displayed amount.",
    "feature" : "Exchange \/ Order",
    "id" : "IOS-MON-01",
    "keyLocators" : [
      "exchange.youGet",
      "exchange.executeButton",
      "exchange.successToast"
    ],
    "launchArgument" : "-ChaosBankDefects roundingDrift",
    "task" : "Exchange EUR→USD and assert the credited history amount equals the displayed 'You get'.",
    "title" : "Conversion rounds wrong into history"
  },
  {
    "category" : "money",
    "condition" : "P&L sign matches actual gain\/loss.",
    "defects" : [
      "pnlSign"
    ],
    "difficulty" : "junior",
    "expectedBuggy" : "Loss shows positive \/ gain color.",
    "expectedClean" : "Loss shows negative \/ loss color.",
    "feature" : "Portfolio",
    "id" : "IOS-MON-02",
    "keyLocators" : [
      "portfolio.holding.TSLA.pnl",
      "portfolio.pnl"
    ],
    "launchArgument" : "-ChaosBankDefects pnlSign",
    "task" : "Open Portfolio and assert TSLA's P&L renders as a loss (negative, red).",
    "title" : "Loss displayed as gain"
  },
  {
    "category" : "money",
    "condition" : "The credited amount reflects the displayed fee.",
    "defects" : [
      "exchangeFeeNotApplied"
    ],
    "difficulty" : "middle",
    "expectedBuggy" : "Fee ignored — credited amount is higher than shown.",
    "expectedClean" : "Credited amount reflects the displayed fee.",
    "feature" : "Exchange",
    "id" : "IOS-MON-03",
    "keyLocators" : [
      "exchange.fee",
      "exchange.youGet",
      "exchange.executeButton"
    ],
    "launchArgument" : "-ChaosBankDefects exchangeFeeNotApplied",
    "task" : "Exchange and assert the credited amount matches the fee-deducted 'You get'.",
    "title" : "Exchange ignores the fee it displays"
  },
  {
    "category" : "money",
    "condition" : "P&L percent is measured against cost basis.",
    "defects" : [
      "pnlPercentVsValue"
    ],
    "difficulty" : "middle",
    "expectedBuggy" : "Percent measured against market value.",
    "expectedClean" : "Percent measured against cost basis.",
    "feature" : "Portfolio",
    "id" : "IOS-MON-04",
    "keyLocators" : [
      "portfolio.pnl",
      "portfolio.totalValue"
    ],
    "launchArgument" : "-ChaosBankDefects pnlPercentVsValue",
    "task" : "Assert portfolio P&L % equals P&L ÷ cost basis.",
    "title" : "P&L % divides by market value, not cost"
  },
  {
    "category" : "money",
    "condition" : "Total balance sums every account.",
    "defects" : [
      "homeTotalOmitsAccount"
    ],
    "difficulty" : "junior",
    "expectedBuggy" : "GBP account omitted from the total.",
    "expectedClean" : "Total = EUR + USD + GBP.",
    "feature" : "Home",
    "id" : "IOS-MON-05",
    "keyLocators" : [
      "home.totalBalance",
      "home.account.GBP"
    ],
    "launchArgument" : "-ChaosBankDefects homeTotalOmitsAccount",
    "task" : "Assert Home total equals the sum of all three accounts.",
    "title" : "Total balance omits an account"
  },
  {
    "category" : "money",
    "condition" : "Balances round to the nearest cent.",
    "defects" : [
      "balanceFloorRounded"
    ],
    "difficulty" : "middle",
    "expectedBuggy" : "Requirement violated.",
    "expectedClean" : "Behaves per the requirement.",
    "feature" : "Home",
    "id" : "IOS-MON-06",
    "keyLocators" : [

    ],
    "launchArgument" : "-ChaosBankDefects balanceFloorRounded",
    "task" : "Reproduce the defect and write a stable test that fails only when active.",
    "title" : "Total balance floored, not rounded"
  },
  {
    "category" : "money",
    "condition" : "The daily change sign matches the actual move.",
    "defects" : [
      "todayChangeSignFlipped"
    ],
    "difficulty" : "middle",
    "expectedBuggy" : "Requirement violated.",
    "expectedClean" : "Behaves per the requirement.",
    "feature" : "Home",
    "id" : "IOS-MON-07",
    "keyLocators" : [

    ],
    "launchArgument" : "-ChaosBankDefects todayChangeSignFlipped",
    "task" : "Reproduce the defect and write a stable test that fails only when active.",
    "title" : "Today's change sign flipped"
  },
  {
    "category" : "money",
    "condition" : "A transfer debits the selected account.",
    "defects" : [
      "transferDebitsWrongAccount"
    ],
    "difficulty" : "middle",
    "expectedBuggy" : "Requirement violated.",
    "expectedClean" : "Behaves per the requirement.",
    "feature" : "Transfer",
    "id" : "IOS-MON-08",
    "keyLocators" : [

    ],
    "launchArgument" : "-ChaosBankDefects transferDebitsWrongAccount",
    "task" : "Reproduce the defect and write a stable test that fails only when active.",
    "title" : "Transfer debits the wrong account"
  },
  {
    "category" : "money",
    "condition" : "Balance-after = balance − amount.",
    "defects" : [
      "balanceAfterAdds"
    ],
    "difficulty" : "middle",
    "expectedBuggy" : "Requirement violated.",
    "expectedClean" : "Behaves per the requirement.",
    "feature" : "Transfer",
    "id" : "IOS-MON-09",
    "keyLocators" : [

    ],
    "launchArgument" : "-ChaosBankDefects balanceAfterAdds",
    "task" : "Reproduce the defect and write a stable test that fails only when active.",
    "title" : "'Balance after' adds instead of subtracts"
  },
  {
    "category" : "money",
    "condition" : "The exact amount is transferred.",
    "defects" : [
      "transferRoundsUp"
    ],
    "difficulty" : "middle",
    "expectedBuggy" : "Requirement violated.",
    "expectedClean" : "Behaves per the requirement.",
    "feature" : "Transfer",
    "id" : "IOS-MON-10",
    "keyLocators" : [

    ],
    "launchArgument" : "-ChaosBankDefects transferRoundsUp",
    "task" : "Reproduce the defect and write a stable test that fails only when active.",
    "title" : "Transfer amount rounded up"
  },
  {
    "category" : "money",
    "condition" : "Conversion uses the correct directional rate.",
    "defects" : [
      "exchangeInverseRate"
    ],
    "difficulty" : "middle",
    "expectedBuggy" : "Requirement violated.",
    "expectedClean" : "Behaves per the requirement.",
    "feature" : "Exchange",
    "id" : "IOS-MON-11",
    "keyLocators" : [

    ],
    "launchArgument" : "-ChaosBankDefects exchangeInverseRate",
    "task" : "Reproduce the defect and write a stable test that fails only when active.",
    "title" : "Exchange uses the inverse rate"
  },
  {
    "category" : "money",
    "condition" : "The bought currency lands in its account.",
    "defects" : [
      "exchangeCreditsWrongAccount"
    ],
    "difficulty" : "middle",
    "expectedBuggy" : "Requirement violated.",
    "expectedClean" : "Behaves per the requirement.",
    "feature" : "Exchange",
    "id" : "IOS-MON-12",
    "keyLocators" : [

    ],
    "launchArgument" : "-ChaosBankDefects exchangeCreditsWrongAccount",
    "task" : "Reproduce the defect and write a stable test that fails only when active.",
    "title" : "Exchange credits the wrong account"
  },
  {
    "category" : "money",
    "condition" : "The fee is charged once.",
    "defects" : [
      "exchangeFeeDoubled"
    ],
    "difficulty" : "middle",
    "expectedBuggy" : "Requirement violated.",
    "expectedClean" : "Behaves per the requirement.",
    "feature" : "Exchange",
    "id" : "IOS-MON-13",
    "keyLocators" : [

    ],
    "launchArgument" : "-ChaosBankDefects exchangeFeeDoubled",
    "task" : "Reproduce the defect and write a stable test that fails only when active.",
    "title" : "Exchange fee charged twice"
  },
  {
    "category" : "money",
    "condition" : "'You get' shows the net, post-fee amount.",
    "defects" : [
      "youGetShowsGross"
    ],
    "difficulty" : "middle",
    "expectedBuggy" : "Requirement violated.",
    "expectedClean" : "Behaves per the requirement.",
    "feature" : "Exchange",
    "id" : "IOS-MON-14",
    "keyLocators" : [

    ],
    "launchArgument" : "-ChaosBankDefects youGetShowsGross",
    "task" : "Reproduce the defect and write a stable test that fails only when active.",
    "title" : "'You get' shows the pre-fee amount"
  },
  {
    "category" : "money",
    "condition" : "The advertised APR equals the rate used to compute the monthly payment.",
    "defects" : [
      "loanAprUnderstated"
    ],
    "difficulty" : "senior",
    "expectedBuggy" : "Payment reflects a higher rate than the advertised APR.",
    "expectedClean" : "Payment computed at the advertised APR.",
    "feature" : "Loans",
    "id" : "IOS-MON-15",
    "keyLocators" : [
      "loans.apr",
      "loans.monthly",
      "loans.total"
    ],
    "launchArgument" : "-ChaosBankDefects loanAprUnderstated",
    "task" : "On the loan screen, assert the monthly payment matches the advertised APR (7.9%).",
    "title" : "Loan APR understated vs the rate charged"
  },
  {
    "category" : "money",
    "condition" : "The percent change sign matches the price move.",
    "defects" : [
      "changePctSignFlipped"
    ],
    "difficulty" : "middle",
    "expectedBuggy" : "Requirement violated.",
    "expectedClean" : "Behaves per the requirement.",
    "feature" : "Markets",
    "id" : "IOS-MON-16",
    "keyLocators" : [

    ],
    "launchArgument" : "-ChaosBankDefects changePctSignFlipped",
    "task" : "Reproduce the defect and write a stable test that fails only when active.",
    "title" : "Market % change sign flipped"
  },
  {
    "category" : "money",
    "condition" : "The detail price matches the market price.",
    "defects" : [
      "detailPriceOffset"
    ],
    "difficulty" : "middle",
    "expectedBuggy" : "Requirement violated.",
    "expectedClean" : "Behaves per the requirement.",
    "feature" : "Asset detail",
    "id" : "IOS-MON-17",
    "keyLocators" : [

    ],